cid,text,time,author,channel,votes,time_parsed
UgyspWL4S1lN4dLQiDR4AaABAg,Just out of curiosity who is the photographer? Photography is one of my side hobbies and id love to see how they shoot their photos!,2 days ago,@Phyzzl,UCuM0BUf4yrnB-NVZDB0otRA,0,1741622871.32573
UgzUa-uj9rdvEqHkWf14AaABAg,Le crossover Amine-Pokimane j'aurais jamais vu venir,2 days ago,@Sen-ki-,UCS-g5DDkzKG7guLh8P9k_tg,0,1741622871.326389
UgxmT-PMkE7pgB0xrA54AaABAg,"The salt in the room is very sus, looks ritualistic.",2 days ago,@TheTruth513,UCAIzV3i1Ci2I3t368GKrXIg,0,1741622871.327043
UgxW4IjJyX05zFxBaG54AaABAg,Elle est tellement belle !,2 days ago,@rldmangore1657,UC09YWPdK9wVimclPX4aJwJw,2,1741622871.327627
UgwPQnoEZ-eS1S4c7G14AaABAg,le combot Douchiotte je m'y attendais pas,2 days ago,@flugelsmj,UCjp5BkzcTZL-RdptLgk762w,0,1741622871.328184
UgziOGYrijmyS1jIq9d4AaABAg,Ils vont finir ensemble les deux c'est sur mdr ya trop une bonne alchimie,2 days ago,@Syskow,UC25YgPZzsMMVsRPjQbddvVQ,0,1741622871.328734
Ugy5AXsVrN7BD0sluTN4AaABAg,Funny,2 days ago,@mitchrousillon7720,UCeUtQBoag2NfDSq5_4LI_fQ,0,1741622871.329272
UgxhvpRLJQHvD0V3iJ94AaABAg,Oh this is a new iconic duo we didn't know we needed. Please make more content with amine! Y'all are seriously hilarious !! c:,2 days ago,@joyfulsvt1634,UCr99VI-s1ydLRIOLOiLno0w,32,1741622871.33011
UgxEdKRC061EzlS1z-Z4AaABAg,😎,2 days ago,@pezzi3277,UCg1U3dczLX0hzAUxusC4ReQ,0,1741622871.330831
UgzZLvIVj_R-23M3ns54AaABAg,tout est gros en amérique et elle a dit letts go🤣,2 days ago,@raphaelcohen6562,UCTYfiFVzyO2oR2W4MbD_s1Q,0,1741622871.692779
UgwM0A6SFff7ZbAyqbN4AaABAg,"14:48 That is Lord Krishna , a major Hindu deity.",2 days ago,@AP24522,UCQTuqPFezqA6foZflwa-jfA,0,1741622871.694456
Ugw35_Ikx-45g-22Vyd4AaABAg,The French accent of @amine is so beautiful 🤣🤣,2 days ago,@AkirasVault,UCYqCUcrXRUw5duHsrrRhAXA,0,1741622871.696532
Ugwj6GpoSF6EZloI7G54AaABAg,i cant lie i agree with shelbo cant have you hanging around with a bigass dude like this its giving hasan vibes we need u to stick around with the less intimidating short guys from usa,2 days ago,@Gamer-hy8ld,UCp6g3QHoOAejOGQynq437DQ,1,1741622871.697539
UgxxsqXhgVUrj7ZRG414AaABAg,"""You don't drink coffe?
You drink Chorba.""
                            -Aminematue",2 days ago,@darkai4653,UCRD1-Ph4m7C5bkjFm-ttoUQ,9,1741622871.698194
UgzDf2E0ybJh0RAtUrN4AaABAg,2:20 wank XD,2 days ago,@silvestersterone,UC8aVqKgfdhiHXppUQzDoxhQ,0,1741622871.698796
Ugy4-ICtlJ-93mCi6T14AaABAg,Merci Stavo pour les travaux,2 days ago,@Slaymes,UCyyeDGP914uCp2IiwcSLYdg,0,1741622871.699345
UgwISat-mqnfjmwjob54AaABAg,“Merci pour les travaux” 👌🤣🤣,2 days ago,@shynnobi,UCtoY3O73uTkeHSP-yGRnfvA,0,1741622871.700131
UgwA_8creR0IyIMtEYN4AaABAg,"""A burger!?"" sent me into outer space LMFAOOOO",2 days ago,@pandajmj,UCumksbtYr6T3Gi338rIXpjA,3,1741622871.700786
UgwIEHcCTgt6gyFo69V4AaABAg,Tellement mignons ces 2! 😍😍🌸,3 days ago,@hkmbeya,UCAt_T-glzKebTXzKh02V_bw,1,1741536471.701348
Ugy2qI_oGmQVfyt1A394AaABAg,Shelbo gon be mad 😂,3 days ago,@cory5197,UCmkHr4IukwOaF2mA8pT38Ew,0,1741536471.701893
UgxaVBvTqpHLXOaOgvR4AaABAg,"Amine il a vu des nudes partout, il a tué son ramadan 👀😂 non le duo est tellement 🙌🏽😂",3 days ago,@MR-mp6cu,UCuRYleh21hYZnJ_s2ShrSUw,0,1741536471.702426
UgzQ_vrMtZhwOs9XEy54AaABAg,Il est venu se lebron james,3 days ago,@ebushnellr,UC8XOKLO50nbX9hWS80mlWMA,0,1741536471.702956
Ugz0PbFKfEqZyCKqWdp4AaABAg,Ptdrrrrr merci pour cette vidéo !,3 days ago,@Megperle18,UC9GAz1t4aDbAx5zsePE8Qfw,0,1741536471.703481
UgyQ2sIGHyAgORfvyeV4AaABAg,"Le sel dans la chambre, c’est très probablement pour absorber l’humidité (avec le bain dans la chambre, il y en a sûrement besoin pour éviter les moisissures)",3 days ago,@cassandre3496,UCJHrm1M6ZhmruJ4XyHz-cnQ,0,1741536471.704011
Ugw7HFsRRChX4y1dKdF4AaABAg,Wsh amine,3 days ago,@titan248,UCpXs1367BY_-CPwCHCyEHcw,0,1741536471.70465
UgzxtoHXCyKO4oJLkrN4AaABAg,"2:19 Not ""work"" but ""wank"" ...",3 days ago,@henny01,UC7FFdTTDU5rdWQxYGSWF0RQ,0,1741536471.705576
Ugz41pd-P3wy7UNl3_54AaABAg,pourquoi il parle aussi bien anglais 🤣🤣,3 days ago,@mimipoukiesauvagemoriau7776,UCq1pU38A71VnA3udWN2n_ZA,0,1741536471.706299
Ugw7LpowOQ6SWZI9VsN4AaABAg,Pokimane et Amine le duo est dingue !!! Plus de contenu ensemble svp merci,3 days ago,@fren2y123,UCnEZNhKRDGvMpXjouwblnSg,0,1741536471.706933
UgwZ_Vyd3NrHsvByCHN4AaABAg,watches Emily in Paris once,3 days ago,@kenkaneki666,UC7nIQRLmPvtfFS28QhStvZQ,0,1741536471.707539
UgyA-UVar5bgALSEb_B4AaABAg,love editor for dirthmouth theme at 3:22,3 days ago,@oels7,UCW3FTLlsgeiQcAVs_wGxhbw,1,1741536472.011408
UgyTFQuQX5pZoS1Jf_V4AaABAg,do they know you shit on white men or,3 days ago,@wxyz2589,UCa_5WitZtyoQAQ-F0aVVtpA,0,1741536472.01443
UgwRC_9L1OnPS_hAuIB4AaABAg,quel lourder ce Amine,3 days ago,@ayoubz7190,UCPGgq0SUhUdackQOqnqHWaQ,0,1741536472.01627
UgxsaPoULfixR1SztmZ4AaABAg,Prochain couple lol,3 days ago,@VictorLOUET-g9b,UCzksI4iU3IjWHmr2XVlGmZQ,0,1741536472.017679
UgxsJXewP97Ee4emy0h4AaABAg,Glad you found a city you really liked.,3 days ago,@fatalheart7382,UCB5yUH_h02fKgolyGAYP23Q,2,1741536472.019014
Ugws5m4bWm_Gv4BU0iR4AaABAg,Merci pour les travaux mdrrr,3 days ago,@jackalop8044,UCvggffWkhmi70fz0dI0Z1Uw,2,1741536472.019693
Ugxxor79hrMym-qcpCN4AaABAg,"Lot's of medicaments, ... Are you OK? 🤣",3 days ago,@j_kvs,UC74I2xt7g7zAJa14idzDJPQ,6,1741536472.02029
UgzW3x0-Qk0zXKK7RIB4AaABAg,"Le sel est mis dans une coupe ou bol pour purifier le lieu. Il doit avoir plusieurs endroit dans l'appartement où des coupes remplis de sel sont placées. Le sel peut absorber certaine énergie négative, le sel est ensuite jeté et remplacer une fois qui change d'état. Ne surtout pas consommé un sel utilisé pour purifier un lieu, vous risqueriez d'être malade.",3 days ago,@elecbrico9552,UCc3xkBNHrfg0-3XlDwr-ZqA,1,1741536472.02088
Ugwxlvfel1dUuOFUsw54AaABAg,Maybe the best international collab I ever seen,3 days ago,@Valissei,UCdPXEOtoH0wE7GI7ffzJyHQ,25,1741536472.021466
Ugwhmu3WP8GQR5ePJFB4AaABAg,"Le Duo le plus improbable de 2025 , mais incroyable mdr",3 days ago,@easygow8231,UCYfnrernlm2o8qOS08RuVHw,0,1741536472.022052
UgxRrA4FIKXfCfSBofl4AaABAg,je vous aimes Amine et poki,3 days ago,@ii-seria_law-ii1897,UCFSQlE7uNV7SqZF9NVLsVxw,0,1741536472.022975
UgytoomGbf3ZN4J5NK94AaABAg,Avoue Poki tu est fan de John Snow du coup maintenant y a Amine dans ta vie MDRRRR,3 days ago,@okgoogle9118,UCGeMxJeCXsKOaKIn_6p2MCA,0,1741536472.0237
Ugz77uqJ4bjGI3TEkSJ4AaABAg,MDRR y a un truc qui ce passe entre les deux ou je reve ? mdr,3 days ago,@okgoogle9118,UCGeMxJeCXsKOaKIn_6p2MCA,1,1741536472.024345
Ugz1MtXC1rTZv__oGdV4AaABAg,Dans la tete de Amine c un urbex mdrrrrrrrrrrrr🤣🤣🤣🤣🤣🤣,3 days ago,@JINXVIpowdered,UC18zcXx0A8kEDnIYquIxecg,1,1741536472.024953
Ugw7yyAc-9ud2Q4fdKd4AaABAg,Amine trying his best to speak english is so funny. It's like he's loading every word before saying it,3 days ago,@chara3611,UCwMnJ916B4bRgmijCCPgBXw,0,1741536472.026012
UgzbecM_RLSJCbhLlVd4AaABAg,sinj,3 days ago,@Creepna,UCqhE2kiSpLFdZgZUb-27nMA,0,1741536472.027047
UgzOPgXdJpZ7aJ2oStt4AaABAg,Vous êtes trop beau❤,3 days ago,@xvatorOwix,UCr3lbIG9KORjA7l5doQHItQ,0,1741536472.028057
UgyAdeTLwMYiNKvRLdd4AaABAg,Does someone please know where the dress that Pokimane is wearing is from? It's SO cute but I can't find it online,3 days ago,@alimee,UCdzvVrvVxEe98A28sORjong,0,1741536472.029048
Ugxf3YsLoPYUY01lJah4AaABAg,ils me font trop rigoler comme duo mdrrrr,3 days ago,@head_inthestars,UC_05Qw6sb3NGrMO95_NH-eg,0,1741536472.030048
UgwYAwGM-Didg5vdtd14AaABAg,Je viens de capter que le prénom Amine est un anagramme du prénom Imane. Le destin 😂,3 days ago,@Ulysse179,UCimcNEO1iM_-ngX9bKF4fwQ,1,1741536472.030962
UgxsaPoULfixR1SztmZ4AaABAg.AFSNw9N6lvqAFSP0VIBsQn,Il s est déjà marier je crois,3 days ago,@jaliyalahrichi6067,UCPGzadoOnwGb9M6ItHCgUEQ,2,1741536472.230139
UgyAdeTLwMYiNKvRLdd4AaABAg.AFSGS3zfuQvAFSPF2SF3mQ,@alimee i'm not telling you,3 days ago,@clownworld5674,UC8mKBSqhN1VQNNejqLU98kQ,0,1741536472.449944
UgyAdeTLwMYiNKvRLdd4AaABAg.AFSGS3zfuQvAFSQhXIOslt,@clownworld5674  Jokes on you I found it,3 days ago,@alimee,UCdzvVrvVxEe98A28sORjong,0,1741536472.452328
Ugx2tINjTvS3ZVZDwhh4AaABAg,It was amazing !! The salt might of being there to keep bad spirit and nightmares away. Amine m'a foudroyer de rire krkrkrk,3 days ago,@Urfavor.t3mermaid,UClWBnNP7_TsG7N3QsYi5kfg,0,1741536472.809413
UgwanPueGOvs6WLMpbF4AaABAg,Il serait tro bau ensemble 😂,3 days ago,@myriamsemmadi3391,UCqHnns-22oPqpJuYEXTvaaw,0,1741536472.810231
UgwU2bNmdg1AnYghXo54AaABAg,Her French 😍😍,3 days ago,@Lprlt0_0,UCXweUSSv8YWBA8HaGVcCDpg,1,1741536472.81087
UgzbdnxL_vC7Azv_sGV4AaABAg,"Une nuit dans cet appartement avec Imane, oh là tout qu'un fantasme de romance et de beauté. Un bain de mousse, du champagne, le rêve 😊",3 days ago,@vincentlabelle7861,UCfcNpO2mtl9VAD10ghCUNAg,0,1741536472.811694
UgxXA4WxVS1kDGkUyiZ4AaABAg,14:51 why is baby krishna there?????😭😭😂😂😂😂,3 days ago,@voldy.thedarklord,UC3ByAF2_jY_-mFltLlliTvw,0,1741536472.812398
UgzFfbaPYJDTVQWng_R4AaABAg,C sur a moins il et déjà avec elle et en le c pa,3 days ago,@myriamsemmadi3391,UCqHnns-22oPqpJuYEXTvaaw,0,1741536472.813136
UgxNRTxXrLyzvJvJHkF4AaABAg,Regardé sa réaction avec elle,3 days ago,@myriamsemmadi3391,UCqHnns-22oPqpJuYEXTvaaw,0,1741536472.813797
UgzlYfgIrTt3iThsdEd4AaABAg,Je reconnais 2 personnes qui se cherche 👀 quand tu rigoles à des blagues mid .. 😂,3 days ago,@urbancouture2641,UCimuM7J9MsFqXZIQLJ7N2jA,0,1741536472.814453
UgymbfhOwltuB820hqB4AaABAg,Amine il veut il veut,3 days ago,@lasaintepatate6314,UCHcSMpN2v0q0fGRaASji3iA,0,1741536472.81511
Ugw_FRpUwMsp3kHtC-R4AaABAg,14:50 It's a Hindu God known as Krishna,3 days ago,@panthergaming5905,UCXiiZdfk6ma8kC7unBxMLOA,0,1741536472.815706
Ugy-S5-lqwDO6hnFw-Z4AaABAg,Moi je croi il et amoureux de elle c sur❤,3 days ago,@myriamsemmadi3391,UCqHnns-22oPqpJuYEXTvaaw,1,1741536472.816327
UgyE0jWStKJN1Su9fFB4AaABAg,my lord his laugh sounded rich😂😂😂,3 days ago,@voldy.thedarklord,UC3ByAF2_jY_-mFltLlliTvw,0,1741536472.816934
Ugwl0gln7zuQitfj0Px4AaABAg,merci pour les travaux MDRRRRR,3 days ago,@iisis_rlb7837,UCBsX5nU2eFMlOJu1RY54yZw,0,1741536472.817523
UgwUDaLXEfApMUXGahJ4AaABAg,Wchbih mbezeg amin 🙏💀,3 days ago,@colonelsami8047,UCYa-Q-5jc2gInH5zvAHKQAw,0,1741536472.818111
UgwdJlO09l-a-Fzx07t4AaABAg,Her French is so good,3 days ago,@Mera.nnz12,UCgNQx8DaIyzr31W_W-VsWag,0,1741536472.818804
UgxVzymuMT-8UFsLfX14AaABAg,"Best Duo 2025, maybe that will conduct to a marriageeeeeeee",3 days ago,@adnane1360,UCWnVJ7vD6VCE2Goy-XZy3rQ,0,1741536472.819612
UgzACdrhJxqUOt_4Qox4AaABAg,wesh amine t'es sah c'est le ramadan mon frère,3 days ago,@LDyt1,UCXDCSrozAjGaqK43BKtMQow,0,1741536472.82043
UgxJ-tbrWUlyXRgruB54AaABAg,Les compétences d'Amine en terme d'anglais s'arrêtent très bas.,3 days ago,@monyclair5357,UC13CLEp2QyVvN90EPsAd-lA,0,1741536472.82111
Ugyzq2DkPwAn9n13TOR4AaABAg,Amine c vraiment le crack international,3 days ago,@barnabetpissenlit4725,UCCDJfGYDfnXEtwzlyBkFyWg,0,1741536472.821694
UgyYHdyyMx4XbHhtKjp4AaABAg,Ah in Paris… nothing bad to say about White people this time?,3 days ago,@vpmvda,UC9T36cLPEgczkUzbibL-sIw,0,1741536472.82228
UgzbdnxL_vC7Azv_sGV4AaABAg.AFSEd84KCk9AFTY1TV46KX,par pitié garde de ce genre de pensées pour toi la prochaine fois c'est gênant là,2 days ago,@louanam3465,UCZ1l4yX6nVZhtuA7X_QD4eA,2,1741622873.055297
UgzbdnxL_vC7Azv_sGV4AaABAg.AFSEd84KCk9AFUckE13CLZ,"Mais soignez-vous, sérieux. C'est quoi ce manque de respect pour écrire des choses pareilles? Garde ça dans ta tête espèce de détraqué",2 days ago,@pookpook3891,UCbi_rXHS6zSmqG_pxNl9GqA,0,1741622873.05765
Ugy-S5-lqwDO6hnFw-Z4AaABAg.AFSE6mmroQgAFSEzClDeCI,et ?,3 days ago,@lolblock7909,UCGU-cNglkE1Ctka6Vk66pbA,0,1741536473.2485
UgzACdrhJxqUOt_4Qox4AaABAg.AFSCgtchT4wAFSF16WVKnD,On est pas tous des chiens hein,3 days ago,@lolblock7909,UCGU-cNglkE1Ctka6Vk66pbA,4,1741536473.451312
UgyZZeR77GRrOW2kYIV4AaABAg,The funniest duo we were waiting for,3 days ago,@Coatiiali,UCChVISRAzjgSIYCHdLMHjMg,1,1741536473.753009
Ugy3hBfSPpTOm16mZcR4AaABAg,Need more content with Amine le sang,3 days ago,@moviteathome,UCXyJt-21wgQHeUdLPlbq5xg,2,1741536473.753713
UgzbiyfPQt-4nueJofh4AaABAg,Y’a un truc entre eux ça se ressent mm a travers l’écran c trop chou,3 days ago,@Nailahajji,UChgod9Q-oA9lxhjHAG1jwNQ,4,1741536473.754285
UgyR85GfrlkZQ_6YXlJ4AaABAg,Heureusement j'avais les soys titres🥶,3 days ago,@younes중,UC3Ag2CKt3E3dc-rI2d4Eq7Q,0,1741536473.754843
UgyBYosucTjW8na1tmh4AaABAg,Merci pour les travaux,3 days ago,@calvinvalla1558,UCpfrMYzCOvcEuah7P_y2PoA,4,1741536473.755449
UgzWbnIArS8nZqvsGFd4AaABAg,Plus je vois cette veste du PSG et plus je me dis que 750 euros c'est de l'arnaque.,3 days ago,@masterpeace47,UC503m0ayl7HRTSN6-kFHqNA,1,1741536473.755991
Ugz8v_JYeNYajkOhP2J4AaABAg,le truc blanc ses de la mortaurat ne surtout pas sentir ou manger,3 days ago,@thomasviegaspires,UCCWLdkFqWmx2QCgssB-AdJw,0,1741536473.756531
Ugw3CFCuGY93IAJv2M54AaABAg,we want more videos with Amine !!!,3 days ago,@Papi-pn4sd,UCWUVdSRuO2wMs-JTg1G35gQ,2,1741536473.757066
UgyRBAmn9GuknBdJmHh4AaABAg,The thick French accent makes it more fun to watch hehe,3 days ago,@vanillaklein,UCMxLb0_8NyqDom2dYw2t0Hw,49,1741536473.757597
Ugz1rzfHI4y1XsWyexN4AaABAg,she wants him,3 days ago,@snowy4658,UCO9wtq-YZLMSGtz-O31WCzw,0,1741536473.758132
Ugw7JgBbM0bDtuCHNYd4AaABAg,y'all just date already.,3 days ago,@Asmo_D_euss,UCwaetfAnepRtGifVqNTkTzg,0,1741536473.758667
Ugya8id7BPxZov5UgAV4AaABAg,C’est incr,3 days ago,@Inna_nima,UCcKeT41HvfF2YKqnKLp0Otw,0,1741536473.759196
UgwPRh45Vt3BsvKV_b14AaABAg,ça serais pas l'emblème des francs maçon sur le lit ? xD,3 days ago,@kyubix20,UCkLJ2e6D-EAu7ItduiQGvaA,2,1741536473.759731
Ugwe2xSTzGaJ7-VUtY54AaABAg,Merci pour les travaux 🚧🤣,3 days ago,@amesama9147,UCYha1HJQ5-5RNanADQi5wWw,0,1741536473.760263
UgzgUskEpmFowKVMCGJ4AaABAg,Actually it's a date 😂,3 days ago,@M8Jeannot,UCpBB6QJJesYr-HVf0QARzOg,0,1741536473.760775
UgxynNbAuV4eyDBH6t54AaABAg,I don't know french (few words only) but this is like watching [insert name here] in Paris but IRL with extra plot ;D,3 days ago,@Annairda_pl,UCROEAeXtsAbh6gg7oObpovg,1,1741536473.761429
Ugz79Qo4VOvAQmYG6yt4AaABAg,ils vont tres bien ensemble,3 days ago,@zorojurororonoa2841,UClRD-YotIy5A2_dpinvtjIg,0,1741536473.761996
UgwmAb-9P_kCxiEnWSR4AaABAg,Vous n'avez pas appris le français a l'école au Maroc ?,3 days ago,@jamel_bxl2009,UCc5uQ35u2U4NWC6DIM3A5DQ,0,1741536473.762527
UgySA3x8jC3pzoB4H7F4AaABAg,15:22 les regards de Poki !!!! Il se passe quelque chose,3 days ago,@Nicolassion,UCJPYFnvdJUoy8PyhhVWJCcA,0,1741536473.763072
UgwQ2p26B0pBB-5B52J4AaABAg,Anyone else feel it? Those sparks and shit... they're flying everywhere i dont know how you could miss it,3 days ago,@IXLFreaKz,UCv4XUi93w3q0QLanRJR7Ecg,1,1741536473.763607
UgzbiyfPQt-4nueJofh4AaABAg.AFSAkLa2-AlAFSBKL4ss7y,"Mais ils sont potes mdrr, si c'était avec une meuf personne n'aurait dit ça jpp",3 days ago,@aexma,UCrLV4ZQglD1ch85MZfbyKbA,1,1741536474.002684
UgzbiyfPQt-4nueJofh4AaABAg.AFSAkLa2-AlAFV-xmvAy9V, @aexma y’a rien de mal à être plus que des amis et ce n’est que mon ressentit trql tu réagis comme si je parlais de toi respire un coup cousine,2 days ago,@Nailahajji,UChgod9Q-oA9lxhjHAG1jwNQ,0,1741622874.004825
UgzbiyfPQt-4nueJofh4AaABAg.AFSAkLa2-AlAFZi_EwB9O9, @Nailahajji  Y'a rien de mal mais tu n'en sais absolument rien. Ce n'est pas parce qu'une femme et un homme sont potes qu'ils sont automatiquement en couple.,4 hours ago,@Jarod-o9c,UCK56YuCRSx7NiH73FAJ7jqw,0,1741781274.007299
UgzbiyfPQt-4nueJofh4AaABAg.AFSAkLa2-AlAFZjJxlV3Zp, @Jarod-o9c à quel moment tu vois écrit couple dans mon commentaire ? Et puis même si je le ressent comme ça qu’est ce que ça peut te faire ? C’est dingue de chercher les problèmes ou y’en a pas et d’être outré pour tout et pour rien on parle de deux personne sur une vidéo si y’a rien d’ambiguë entre eux tant mieux et si y’a quelque chose entre eux tant mieux aussi vous etes dingue quand même,4 hours ago,@Nailahajji,UChgod9Q-oA9lxhjHAG1jwNQ,0,1741781274.009242
UgyxWsCAEAFtxbUGu-94AaABAg,Mais le pot de sorcellerie et la tête de goat sur le lit,3 days ago,@Tahia213,UCmhqLiwsJs1xaSJfLvgc8YA,0,1741536474.368525
Ugz1F3k0s3H-tHnBpH54AaABAg,Amine c'est un tueur 😂😭,3 days ago,@lxGrimmjxwxl,UC-Q6CLaujgaATOniwY8Nc_Q,0,1741536474.369616
UgzvMXz0MXiBRroedDJ4AaABAg,Poki the salt in the bowl is for the humidity. The salt is very usefull. When u drop anything in water just put that in the salt (its not a joke),3 days ago,@lxGrimmjxwxl,UC-Q6CLaujgaATOniwY8Nc_Q,0,1741536474.370532
UgytnV1Fik_8oJ7otMl4AaABAg,SINJ ❤,3 days ago,@benzing65,UCbGGYbBghKHfO41sY0zR0OQ,0,1741536474.371236
UgxOUTyFY3g4yCxXswx4AaABAg,1:28 the holy grail was almost attained boys,3 days ago,@IXLFreaKz,UCv4XUi93w3q0QLanRJR7Ecg,0,1741536474.371871
Ugw2cbglyI9HyFF57ZV4AaABAg,Mais le vlog est incroyable srx ils sont grv mignon grv complices ensemble c’est drôle,3 days ago,@Nicolassion,UCJPYFnvdJUoy8PyhhVWJCcA,11,1741536474.372491
UgyP4Gax6ZQCiYFYdNl4AaABAg,13:16 PRIS EN FLAGRANT DÉLIT!,3 days ago,@Sooshu-lover,UCKHvTxdwVQP_uHDXa40bBzQ,8,1741536474.373083
UgybbQeWYaxEhKcMcQN4AaABAg,in America that coffee is an expresso shot size,3 days ago,@Manic_strawberry,UCpLjZrUX6f4zQeSEjbbT6Rw,3,1741536474.373674
UgxaIAUmxIUm18-xpx14AaABAg,Heyyy Billy il a changé 😂😂😂😂,3 days ago,@julesgoupil8426,UCs6OgexPzgVu4EV-5tLUa7w,1,1741536474.374263
UgxBF5Pdv72IUfT5gJt4AaABAg,17:37 le cadrage 😭,3 days ago,@charlottolauto,UCaTYCw57Z2ym9zEGkzFzIsg,6,1741536474.374855
UgyNQSYQMWIxshhm0Mp4AaABAg,SINJ,3 days ago,@dylanhoarau1000,UC1uUAd-e0KlaaDOl73Djdaw,0,1741536474.375456
UgzJGIxedEypfEw37Ix4AaABAg,Les français vous êtes où ??? 🇨🇵🇨🇵🇨🇵🇨🇵🥖🥖🥖,3 days ago (edited),@68cens.677,UCAZSpYctVzTPTal0uFfH93w,4,1741536474.376052
UgzeCJWtHojmfKO2NvB4AaABAg,"En sah, Amine il est vraiment partout cet harceleur",3 days ago,@InfiniteFrequenciesStudio,UCDtge0-ipp9q7TJwH_bfTIA,0,1741536474.376645
UgzxWyjNdQDDKApVFK14AaABAg,Amine va se taper poki la tchoin,3 days ago,@kyky44000,UCFKWfnCsqigkJlciz8iXUYA,0,1741536474.377249
UgwiGETmyaQ2Y6rUW6V4AaABAg,You genualy give your adress bro be careful,3 days ago,@wanderer165,UClY43ats9cDyP2Jy98Xgs8Q,0,1741536474.377829
Ugw_s1f95-gy5Bi6q494AaABAg,ils sont en couple ?,3 days ago,@norahalonso916,UCc-LxKMkS3HQ2BHHGr1Qm4w,0,1741536474.378419
Ugyv22afrmslZF-5tgd4AaABAg,amine le gros singe,3 days ago,@wshhimaaa1003,UCN2hSdX7Hjta3E1hGCJM1Bw,0,1741536474.379001
UgxlvxLQS7TA9w5ZWC54AaABAg,T'es pas un chien t'es un mec capable t'inquiètes pas Amine (ou un esclave capable mais c'est bien aussi),3 days ago,@chlochlo2571,UCjTEwxZA8QjtcYVSw5GPpFA,0,1741536474.379579
UgxN64V3SVRVKRf5xLl4AaABAg,amine boss,3 days ago,@benblk4909,UCcA4y02r3tJfYBmhHbMB94Q,0,1741536474.380378
UgxPNHOBTUI6XXjldA94AaABAg,ILS Sont tout le temps a 2 arrrgh,3 days ago,@benblk4909,UCcA4y02r3tJfYBmhHbMB94Q,0,1741536474.381243
UgxBF5Pdv72IUfT5gJt4AaABAg.AFS3Dra36FKAFU4C6Dz6Qz, @charlottolauto  c la signature d amine tkt 😭,2 days ago,@Ploof_3,UCJvn1RI0ro1XvaPJwrBtrJQ,1,1741622874.589796
UgzxWyjNdQDDKApVFK14AaABAg.AFS1_OChwrQAFTZgLREZla,commentaire de maxi golmon,2 days ago,@louanam3465,UCZ1l4yX6nVZhtuA7X_QD4eA,1,1741622874.782406
UgzxWyjNdQDDKApVFK14AaABAg.AFS1_OChwrQAFUcuQEsk4Z,Aie un minimum de respect pour amine et pokimane stp. Sinon reste silencieux avant qu'on ne dise pareil de ta daronne,2 days ago,@pookpook3891,UCbi_rXHS6zSmqG_pxNl9GqA,0,1741622874.784236
UgwiGETmyaQ2Y6rUW6V4AaABAg.AFS1QJjqFaVAFS2eqCnSiX,@wanderer165 it’s not her actual appartement but a airbnb like she said :) she’s probably not in it anymore,3 days ago,@lixfeels143,UC_7WIeKnpql4jBydihkIE6A,1,1741536474.984169
UgwXEaxDANpr9ot5EGp4AaABAg,SINJ,3 days ago,@Narigeek,UCjOtZK80VNSFjzPTpO9OFqw,0,1741536475.300588
UgxJFHtlqmjX4_jtC8V4AaABAg,amine t'es un pirate,3 days ago,@Zzzzz93-d5q,UC9w34gy_KD75a5T3cs5eaJg,0,1741536475.301201
UgyyClabGafZdYGbBCt4AaABAg,Mdr,3 days ago,@Lespoupou,UCdhCqTcP7zjW1fSt_-RdCoA,0,1741536475.301748
Ugxm28n48Qwj9LgYbu54AaABAg,Masterclass,3 days ago,@Schlaousilein67,UC7aIjE8CSiCe50ToK0U6IiQ,0,1741536475.302282
UgxSawRc_m5C4fuTXM94AaABAg,Hi Imane please stay safe and don’t film your windows ! French man are really dangerous,3 days ago,@epyosa,UCgGW0POzny8Lg7ZwiXPYUkQ,1,1741536475.302812
UgxyqMuGMbt8XyWnheJ4AaABAg,Elle aurais pus ranger l’appart avant quand même car la c chaud,3 days ago,@hvbrooky7258,UCxfIWjob7Zh7887eBCqlMNA,0,1741536475.303336
UgyxqzvPBCUSIXM1Imp4AaABAg,"14:50 that black and white picture is baby Lord Krishna, a Hindu God 😊",3 days ago,@divyasrimahadev1834,UCT1KbrbbGFrtALlad3PAjQA,0,1741536475.303864
Ugws0ALLyo50l_G63hN4AaABAg,Le niveau d’anglais de amine me fait peur,3 days ago,@Lu_lucie,UCichXFnoZFmBhUzHopuEcOQ,1,1741536475.304736
Ugwvs-a7JRmzLOxyPQ14AaABAg,I love this duo poki x amine ON ADOREEEEE😭🫶🏻,3 days ago,@sawsanesmaili6755,UCkpD0JBhwwT_56erTiZKAFg,1,1741536475.305995
UgxlNsXD4ImUCmSCdyN4AaABAg,vous me le branlez celui la,3 days ago,@HeyDo29,UC1NzdeORKU1LULLAMsX-Xzw,1,1741536475.306806
UgykKk5y0dYj5ZSjRPt4AaABAg,L’appart a 10k par mois,3 days ago,@hvbrooky7258,UCxfIWjob7Zh7887eBCqlMNA,0,1741536475.307606
UgzDeeGZ5TWSHwXRF8d4AaABAg,You two are so cuuute,3 days ago,@louloulink2,UCW2oXm50t1WYMxOOqABqJ1g,6,1741536475.308238
Ugzv9EUsB1pvZl6S7Rh4AaABAg,6:12 c’est tellement une princesse je peux pleurer,3 days ago,@acyls,UCjwHMJm_ZSt0_KfY4BOOmPQ,2,1741536475.308809
UgxPFdH2RHtgsgf_j5R4AaABAg,"11:14 I have a familly castle, this is a CRIME; these armchairs are super expensive and fragile and everything. I litteraly got an heart attack ! I'm actually very mad even if it's not my stuff",3 days ago (edited),@toinouH,UC2ojTp28ufpC4xkwl0cYILg,0,1741536475.309356
Ugx_RoXtS8s0oGWoLpp4AaABAg,The decoration in your appartement is UGLY LOL,3 days ago,@Blolf,UCXNtAmBYogl8kHoPmBi6kPQ,0,1741536475.309893
UgyfmzOo7zYAuC8qFv54AaABAg,The duo I never knew I needed,3 days ago,@Prettyyyyx,UCxeoju7GnKUrM74IDA4eDWg,3,1741536475.310423
UgyIeciTY5x8mzwntMx4AaABAg,Il est giga étrange l’appart et je vis à Paris 😭😭😭,3 days ago,@Lu_lucie,UCichXFnoZFmBhUzHopuEcOQ,3,1741536475.310951
Ugx5UiYsGmrl2qaqtZ54AaABAg,"14:47 it's an indian god, Krishna XD",3 days ago (edited),@xctober9496,UCX7C1aqu1DsZ0FH1A40DUYg,2,1741536475.311494
UgzzX61nVqRPRV-0mC14AaABAg,uhh.. madame!! fire crib! 🔥,3 days ago,@xctober9496,UCX7C1aqu1DsZ0FH1A40DUYg,0,1741536475.312019
Ugx5scMdbGnY3UAnxxt4AaABAg,la vidéo est trop bieeeeeen T_T,3 days ago,@acyls,UCjwHMJm_ZSt0_KfY4BOOmPQ,2,1741536475.312544
UgxSawRc_m5C4fuTXM94AaABAg.AFS0BtGd2dNAFSF9lbgOxB,all mens are dangerous,3 days ago,@lolblock7909,UCGU-cNglkE1Ctka6Vk66pbA,2,1741536475.530726
UgxyqMuGMbt8XyWnheJ4AaABAg.AFS-QQ5CsctAFS1tb74bfC,Elle vient à peine d’arriver 💀,3 days ago,@keksk.e8962,UCaOq5yOzKMn958SkyBwwvqg,1,1741536475.758455
Ugymrwp-US9Bws-_mmh4AaABAg,EP 2 😂🎉,3 days ago,@DAVID_75000,UCnji8DzwyaBs0KV2CCEbpfQ,2,1741536476.084284
UgzllKA0lvFv0VShPzF4AaABAg,Imane and Amine sounds like a destined name haha,3 days ago,@emmie9102,UCwI5q0lwWuexMAYfdRP_W6w,6,1741536476.08592
UgzIcSAaKub2ESsdvxV4AaABAg,"You put salt on the corner of a room put keep spirits away, maybe this AIR BNB is haunted....",3 days ago,@louiselenepveu6326,UCN-gpedU8hGbviCRS-Y_PHA,2,1741536476.086648
Ugzv6jlNF_d_HRnz1294AaABAg,C'est quand que vous officialisé votre couple ?,3 days ago,@bourguibab6075,UCNy24DZCGUCUPNqIhSVadkg,9,1741536476.087224
UgwJKKX6mdBOsw5z2nh4AaABAg,He’s so annoying and stupid. I hope she never dates him,3 days ago,@ericanl,UCncNPWNiOqTE692_lhx5iUA,1,1741536476.087789
Ugy-3CvVV7cbg1ynXvV4AaABAg,Salt to absorb humidity,3 days ago,@bourguibab6075,UCNy24DZCGUCUPNqIhSVadkg,0,1741536476.08833
UgxRJfZYHDPoyz-iB3x4AaABAg,mettez vous en couple,3 days ago,@VitaGasnier,UCepG1zpGXc4TYsnApOnfqsg,0,1741536476.089136
UgzAqmOc8Ze0Y7Oi2GZ4AaABAg,THIS VIDEO IS SO UNDERRATED WHATTT,3 days ago,@Notkahina,UCTi4hQbER8_rR9cqrjUxv6Q,6,1741536476.090149
UgyC6GvMyAe-8RiAbBN4AaABAg,Le meilleur duo du moment !,3 days ago,@nockzia2245,UCd2wvcTlcVDdwyiuggBkvjw,2,1741536476.090678
UgzuwS-wFVa_CvO56oV4AaABAg,Amin c'est un canard en fait,3 days ago,@bourguibab6075,UCNy24DZCGUCUPNqIhSVadkg,5,1741536476.091203
Ugxym12UmD7XBya_ZBh4AaABAg,MERCO POUR LES TRAVEAUX !! 🤣,3 days ago,@kaguyaotsutsuki1402,UCBwewauLrSVzjWnhzo-PLGg,0,1741536476.091737
UgzBEkCDpMSLdZz2z2p4AaABAg,"4:00 le ""yeah va te faire foutre"" m'a tué de rire, pokimane t'es trop adorable je t'adore😭🤣❤",3 days ago,@its_kioko1,UCZt6Ji3NMORoAQ6m-L0eQZw,1,1741536476.092274
Ugy2nQdkCKBTgm28giV4AaABAg,medicaments il a dit hahahahah 😆,3 days ago,@dojadog1337,UCd80llNa2Va-N6F53zGjvrQ,0,1741536476.092957
UgzUBAyOmQpVRKWNrZp4AaABAg,Faite du x,3 days ago,@mael_uchh8652,UC_10wpAoEs4LY9dexORNpEw,0,1741536476.093942
Ugw2atvU00dg1tKzOEV4AaABAg,Est-ce que je suis la seule à être en turbo stress qu’elle montre autant d’image de la rue et de la cage d’escalier ? Trop peur qu’un taré la traque 😮,3 days ago,@psykiwiii,UCfStz95gh0IIrPAaVNWCK5Q,1,1741536476.094942
Ugzepc8Cu7aJG8uevVV4AaABAg,why are your walls covered in trash you could find in a yardsale after a week after the good stuff has already been picked up?,3 days ago,@Happypizza1134,UCgp1vGqp6nMYRwLG1EUx9zg,0,1741536476.095634
Ugyg-u3N1pKbhLJFVLx4AaABAg,amine il est piqué je pense,3 days ago,@cestlebon972,UCvvwRhEUoeQ6Hfva90OBJdA,7,1741536476.096423
UgxR9unajHsgOjbdshd4AaABAg,C'EST BON ON SAIT !! VOUS ÊTES EN COUPLE ???,3 days ago,@Seomi_ytb,UC1hVJ-2ShfaPn6MsFucFgQw,7,1741536476.097105
UgzbIuTiFw1DaI9QFfZ4AaABAg,Amine x Pokimane ❤❤❤,3 days ago,@raminouboinariziki4806,UCktSSOplci-kAgtFQAedH6g,5,1741536476.097789
Ugxd7E_SNAxwnm_SJg14AaABAg,same story with la sirène and Inoxtag,3 days ago,@loickristic7105,UChA8Oh6v-xfdfLfEq5GaQOg,5,1741536476.09833
