cid,text,time,author,channel,votes,time_parsed
Ugz5CrmdnSASuUGGfjJ4AaABAg,Sa vous rappelle pas qu'elle que chose?,4 days ago,@Samy2011-h8y,UCnjakqzoKUtSDNxY11Icw2w,1,1741453682.660677
UgwrsmYM-i6HSmx7IXZ4AaABAg,Bro pokimane is (hearteyes) in this video *like,4 days ago,@MoSizzlac97,UCoMzYM0GhBTBokO22gS4_7g,1,1741453682.661192
UgzrzCtdWccBTGp449x4AaABAg,"Vous êtes adorables tous les deux j'adore votre duo 🥺 !! J'espère que Paris te plaît, passe un bon moment 🤗❤",4 days ago,@sorayapaul5688,UCI0-z1cwu4Dw9NKRHs6qvew,4,1741453682.661716
Ugw17xjVJ4GCn2TdRtR4AaABAg,Amine + poki = next couple goals,4 days ago,@MrProXia,UCX37S5nW7enjRrVX6SeTdfA,3,1741453682.662209
UgwXr9pmcDWQ_PicntV4AaABAg,amine le bb de la street,4 days ago,@sweetlikeocean,UCz6RGc5U2BsYskM8clDsy3A,0,1741453682.6627
UgygTsn14cqD1Ao9oM14AaABAg,C'est un rbnb ?,4 days ago,@lyodz2949,UCelX9WaPRaGYDA59VPMueKw,0,1741453682.663421
UgyvNuAUl2OD-AQzR854AaABAg,Did you sleep with him? 😅,4 days ago,@nabinsu1726,UCWBcz24TnsNFkwQie__0tOg,0,1741453682.664017
UgyUNIVy_sptXLgdpiB4AaABAg,Je suis quasi sûre que le sel sous le lit c'est pour éloigner les mauvais esprits,4 days ago,@auriane_6755,UCRPOxbqL4ZO0kwostkqr8cw,2,1741453682.664669
Ugx2lAO-x8iCrhmYlj14AaABAg,best video !!!!,4 days ago,@ismaelsmile7,UC78P8uTFcWYJ5_02grTRSZQ,1,1741453682.665318
UgwMuQMufavwexHSxHF4AaABAg,Meilleure duo fille garçon !❤,4 days ago,@Étoria_ytb,UCJao9FNPh0lZ-xc4Njhbyvg,2,1741453682.666003
UgwXdM4rTHtuNpEChUx4AaABAg,:face-red-heart-shape::face-red-heart-shape::face-red-heart-shape::face-red-heart-shape::face-red-heart-shape:,4 days ago,@ismaelsmile7,UC78P8uTFcWYJ5_02grTRSZQ,0,1741453682.666529
Ugz81LEM2y_meCF26Qx4AaABAg.AFPq0chb8bgAFS304VHURh, @mopater   mais oui 😭😭 dire que dans la vidéo de Squeezie des pires dates il a dit qu'il était pas a l'aise avec les filles 😭❤️,3 days ago,@Chuu_alice,UCNejEaChIuTNad2_5oxzN9A,5,1741536482.871818
UgyvNuAUl2OD-AQzR854AaABAg.AFPmq8hoxBSAFPoGQaAk4Y,Idiot,4 days ago,@Lucia_enha,UChhcc5Br8JwivpNe-l8nT4A,9,1741453683.085783
UgyUNIVy_sptXLgdpiB4AaABAg.AFPmUUoNYy8AFPoIXiHuyv,Je pense que c pour les insectes,4 days ago,@Lucia_enha,UChhcc5Br8JwivpNe-l8nT4A,2,1741453683.291664
UgyUNIVy_sptXLgdpiB4AaABAg.AFPmUUoNYy8AFPusiZnEld, @Lucia_enha  Ah oui possible aussi!,4 days ago,@auriane_6755,UCRPOxbqL4ZO0kwostkqr8cw,0,1741453683.29384
UgynhBKK86rFp4nv7wJ4AaABAg,17:00 c’est du sel pour l’humidité tout simplement,4 days ago,@yannmoizan1115,UCQEAwhbtPWSf77jjdQ5r2dQ,2,1741453683.645974
UgyQT_RBQEcgeisOBRF4AaABAg,J’ai l’impression de voir inox et la sirène,4 days ago,@ewenlmstr,UCpMiiNeYeCMeJTJa_c6CMZw,0,1741453683.647358
UgwXBawyhCvc7kxzAd54AaABAg,En sah amine il est amoureux la,4 days ago,@yannmoizan1115,UCQEAwhbtPWSf77jjdQ5r2dQ,0,1741453683.654074
UgwjHDvzAb1tHtNTgst4AaABAg,parle francais la,4 days ago,@MK_458PB,UCvK0REnT7hcCzyfvlBZ6o6A,0,1741453683.656592
UgwkrNeg069X9pNy6ph4AaABAg,Le bol de sel que tu as trouver c’est pour empêcher les mauvais esprit d’approcher donc t’inquiète pas :),4 days ago,@Digsieg,UCfmjgW6Y9cNICc-sQhatVQQ,0,1741453683.658265
UgzXH3QTWvjUAZtO-lZ4AaABAg,"Allo police, ya un Arbre dans mon appartement...",4 days ago,@bensak773,UCR0ySCp5I37TpaVS5Gx78Ww,0,1741453683.65906
Ugw-dcJ6YkRpMcIM8lN4AaABAg,That couple 🥰,4 days ago,@mickblm8879,UCckM-uK1Y8RYTcW0QoPJKTQ,0,1741453683.659642
Ugw9Vo6luf-CiKOBGe14AaABAg,AMINE EN 100% canard  XD,4 days ago,@Monsterlv9,UC1EDQDCamMn4jJznxKoyKVA,0,1741453683.660202
UgzzzcWpbuaYrBPtswZ4AaABAg,2:22 No he said wank we know him ahahahha,4 days ago,@hugoduhamel2608,UCTDNcTPD6LC4Tszk70Dl4bA,2,1741453683.660743
UgzyrSIkwFyddfaoeOt4AaABAg,19:00 Gangster from Texas (if u have the ref),4 days ago,@deucaalion,UC2hPG5GWM-mH_oPYCcf3qxA,20,1741453683.661285
UgwPdj6b3Dxgggbskwt4AaABAg,Amine en mode tiper dans 2 mois il arrête les stream et revient faire des annonces a perte comme billy,4 days ago,@Frenchygoat,UCe45KEgohZ_aX95LIGhmcww,0,1741453683.661854
UgwmEb-CVEBNAGvYITx4AaABAg,merci duolingo j'ai tout compris,4 days ago,@sassooouuu,UC1CPg7kiY0OGD0e0C8sbv8w,3,1741453683.663093
Ugzk-GW9K4Q4LMt9YQB4AaABAg,Ce duo est trop drôle ! 💚😂,4 days ago,@sasaslys,UC4yl6FuCcbkFcirZ25n0Nuw,0,1741453683.664347
UgyrptGKZD6Qb00nvrd4AaABAg,girl come back to franceeeeeee,4 days ago,@koko-gl1iw,UCVJonPvFM563FdeYUnpo5Cg,1,1741453683.665468
Ugw0Mt509wD08i2p31h4AaABAg,Pokimane tu devrais faire une vidéo avec les Jacksons des youtubeurs français très drôle,4 days ago,@Skilos.330,UCTursTkM7KmiItr9F0-ilNA,0,1741453683.666438
UgxLf-HKupuec6f_uCh4AaABAg,"""what do you mean I'm a burger?"" 😂",4 days ago,@ggpixi6187,UCQfP6q4QRcdnOuUydDwDjyw,0,1741453683.667513
Ugzs_kvyulJSFT9_YOB4AaABAg,this guy is so funny omg who is this le mec qui s'fait passer pour un anglais,4 days ago,@mysticftn,UCBmMj49xtIIlIDfLnGThPDQ,1,1741453683.668193
UgxkurDBoX0YGY-If-R4AaABAg,i love so much content with amine❤,4 days ago,@theclubgab,UCjbZ1kEmOFVe2IC4Q1zFsfA,7,1741453683.668786
UgwGyERRazXWhh0dt_N4AaABAg,"Ca me fait bien marrer de voir cette femme toute indépendante qui s habille a l occidental (léger) avoir fait tout un cinéma pour la Palestine alors que la bas elle se ferait mettre a la cuisine et elle devrait fermer sa gueule, tout le paradoxe des gauchistes occidentaux c est a mourir de rire et pitoyable a la fois.",4 days ago,@geronimodalton7693,UCeVv0Al4bslNS7xsNK9aVOA,2,1741453683.669376
UgwaBQZEofJS1gyK-VR4AaABAg,le bol de sel que tu as trouvé sous ton lit sert contre l’humidité !,4 days ago,@MaraHnzz,UCrf6g2aXZpR4zeL7p0O4x3g,0,1741453683.670115
UgwGyERRazXWhh0dt_N4AaABAg.AFPgAehg3hhAFPi-BYp4q4,va te faire soigner tpmp ta fumer le cerveau toi,4 days ago,@yjeseed85,UCGxQ5D7YV9phP6xf6zpgaNw,14,1741453683.904117
UgwGyERRazXWhh0dt_N4AaABAg.AFPgAehg3hhAFPi_B2R1G8,WAAA LE FOU RIREEEEEEE nan t’es chaud,4 days ago,@p77sph,UCIkhzIM4QHVuS-E3W0Rclsw,0,1741453683.905617
UgwGyERRazXWhh0dt_N4AaABAg.AFPgAehg3hhAFQDCRArXoy,"Sinon, on peut à la fois se battre pour que les femmes s'habillent comme elles veulent et en même temps que des crimes de guerres contre des population ne se fassent pas sans impunité ... l'un n'empêche pas l'autre",3 days ago,@alexia9351,UCbjfLFTGQ0b4mBmI9DLBJ-Q,2,1741536483.907179
UgwGyERRazXWhh0dt_N4AaABAg.AFPgAehg3hhAFRlxgEFXD6,"La plus part se batte pour un peuple qui les déteste (car occidentaux) tout le restant de l’année,et ils ne s’en rendent même pas compte puisqu’ils sont dans leur petite monde d’entre soit😂😂😂",3 days ago,@Azurasmar0,UCGVds5-1K1pNqtVeTxRjlRQ,0,1741536483.908641
UgwGyERRazXWhh0dt_N4AaABAg.AFPgAehg3hhAFSxCQC2RP_,"""gauchiste occidentaux"" then it's just not supporting a genocide, au final tu as juste 0 valeur et tu le montres bien",2 days ago,@okk4562,UCIAL5vqrwyLsT0hkiUKMcoA,0,1741622883.91077
Ugz-iejsQyQIcKhjjBF4AaABAg,"On veut plus de vidéos comme ça, meilleur duo !🫶🏻",4 days ago,@asap5035,UCyHug5M44jF-msH3lmkFRrA,3,1741453684.280112
Ugywcncy9LQT-Ja7DTd4AaABAg,"""This protective quality of salt is a common thread in many spiritual traditions, highlighting its perceived power to ward off evil and maintain spiritual safety. Many people think salt can keep bad things away. They use it like a shield to protect their homes and themselves.""",4 days ago,@highcue,UCjJiqgwnuu3mWghfzJaPktQ,0,1741453684.282332
UgwJLxTJV-9bu9c29rx4AaABAg,Amine il veut pas chela sa grosse veste la,4 days ago,@zden9293,UC-ug9BQuPuJo5JB3_EeH9ag,0,1741453684.288922
UgztjqnqYPc8Y7NzaEJ4AaABAg,You finally came after 1 month 😅,4 days ago,@BrainOki,UC4sF3nU2A_IMNQvmas7S17A,1,1741453684.29092
Ugxo4ftDm9oc8RyFh_B4AaABAg,Great video ! I love Amine; we can see that he's funny and a great guy. We want to see more Paris videos !,4 days ago,@RushHaru_,UC6iXq2nZOQlRU7HiqIRpZdw,5,1741453684.293163
Ugz1AL59ZO2eMev0NVV4AaABAg,Y a plus de frr dans les commentaires que de US juste éteint,4 days ago,@cocainorapmusiceliot6164,UCVJwCApiJtKH8FFNRI0KMsw,0,1741453684.29553
UgxHY-3nuXXcEh5so8x4AaABAg,amine l'a froudroye,4 days ago,@zbi2169,UCabvT17MMDHW0h1Drbc2A7g,2,1741453684.296281
UgwaQrdDFa22nlaY22t4AaABAg,pourquoi amine est la?,4 days ago,@metafor5335,UCIkm8WYcQnDd4h-QobUCKYA,1,1741453684.296874
UgyvnpU39AMJg2eaZ294AaABAg,Pourquoi il y a Shakira dans la description 😭,4 days ago,@Kitano__Ken,UCFn_csr-8n5RhZV9mYBynIg,0,1741453684.297662
Ugz_Oho4GTXAMi-lxsV4AaABAg,La Belle et le Sinj 😂,4 days ago,@Kitano__Ken,UCFn_csr-8n5RhZV9mYBynIg,0,1741453684.298332
UgyD3IewSfHMgRjRdfB4AaABAg,Youre inspiring me to learn french again,4 days ago,@Krisistv,UCRM2dac9qdh-DIlgCGES5BQ,2,1741453684.299093
UgxLE2vh4RNw88im9U54AaABAg,VOUS TELLEMENT FAIT POUR VIVRE ENSEMBLE ::: TOI x AMINE 🙏🏽😜🤎,4 days ago (edited),@ARTY.CREATION,UCFesasnM2nOlB3rtSZdZ5fQ,1,1741453684.29975
UgwxLP_kcua0ebI00XV4AaABAg,2:32 Leagueeeeeeee,4 days ago,@YamzieMoyo,UC0FduCCfQStexENqi_66s1w,0,1741453684.300411
UgxJrxZXCtPTiJSRf0R4AaABAg,"14:50 Search for Lord Krishna he is the one of the supreme god of Hindu. He is the god of protection, compassion, tenderness, and love.",4 days ago,@DiwasAtreya,UCprRYOr1nWjKDklvvBIqw5g,0,1741453684.301104
Ugy1zunQ9ZKVFtwvAfh4AaABAg,"Je rêve  d’une histoire amoureuse entre c’est deux là, ils sont trop cute",4 days ago,@lourbn7224,UChXykToqDscY1SaoFYxxUpw,28,1741453684.301773
UgwioZGeuTDSSeF24cR4AaABAg,Quand un algérien rencontre une marocaine ❤ une belle amitié,4 days ago,@lilou8711,UCkRZ8SQiOpZVnIYXimIbf6Q,6,1741453684.302344
Ugwz3ofiJ5iuFc-99i54AaABAg,such a beautiful apartment,4 days ago,@rltowers4090,UCSFrL0y_AkQxPFCTh62KNdw,1,1741453684.302898
Ugxnnaj8SurO9H6DHuN4AaABAg,❤❤❤❤,4 days ago,@MJavedIkram,UCmU5RCOh6LL0D2kbbV3wyCQ,1,1741453684.303686
UgwCYM7ACKAxgPaVVWt4AaABAg,2:21 he said he wants to Lebron James by the way...,4 days ago (edited),@POLHO0,UCB48IbauBTu54YdEZieyUtw,0,1741453684.304686
UgwTTkjqRxv-lxvN3E14AaABAg,god your look so fine two girls 🙏🏼,4 days ago,@lyxrs,UC2nebYsd2y2Bq4GFtEpws6g,0,1741453684.305635
UgwaQrdDFa22nlaY22t4AaABAg.AFPcxiIz-dWAFRm0bpKKSH,Pour la poutre é,3 days ago,@Azurasmar0,UCGVds5-1K1pNqtVeTxRjlRQ,0,1741536484.506352
UgwaQrdDFa22nlaY22t4AaABAg.AFPcxiIz-dWAFSxNkKFYiJ,"​ @Azurasmar0  tu n'as aucun respect ni pour les femmes ni pour Amine, vraiment honte à toi",2 days ago,@okk4562,UCIAL5vqrwyLsT0hkiUKMcoA,1,1741622884.508299
UgyD3IewSfHMgRjRdfB4AaABAg.AFPcOKnPpJLAFPcm2Ysgb1, @Krisistv  i could teach you some,4 days ago,@noneayrad,UCMZb7WoBXPVCUZhrYgE1AEw,1,1741453684.718692
UgyD3IewSfHMgRjRdfB4AaABAg.AFPcOKnPpJLAFPdi59mVvC,@ I know the basics maybe if I can remember right. I am very confident singing the alphabet song in french tho,4 days ago,@Krisistv,UCRM2dac9qdh-DIlgCGES5BQ,0,1741453684.721036
UgyD3IewSfHMgRjRdfB4AaABAg.AFPcOKnPpJLAFPe8W8pcBJ,fait toi plaisir,4 days ago,@chiwuasuna,UCDIAd32xAoqGbePDlxZjiFg,1,1741453684.722684
UgyD3IewSfHMgRjRdfB4AaABAg.AFPcOKnPpJLAFPf4TKw2XE, @chiwuasuna  hmmm I may need to start from the beginning 😭,4 days ago,@Krisistv,UCRM2dac9qdh-DIlgCGES5BQ,0,1741453684.725309
UgyD3IewSfHMgRjRdfB4AaABAg.AFPcOKnPpJLAFTvoPSVcno,​ @noneayrad  ce neuille essaie de gérer cette latina,2 days ago,@playb1joestar,UC3vDkNIQix6N5PlJ_QtP4Sg,0,1741622884.727797
UgwioZGeuTDSSeF24cR4AaABAg.AFPagfw5PSiAFRm8GRyG4e,Oh he’s not a « French youtubeur » suddenly😮,3 days ago,@Azurasmar0,UCGVds5-1K1pNqtVeTxRjlRQ,0,1741536484.966188
UgwioZGeuTDSSeF24cR4AaABAg.AFPagfw5PSiAFRz6SjQFnW," @Azurasmar0  no he's algerian, we don't claim him as french.",3 days ago,@elendile47,UCcNhxTapeKiqPhxbnPSZ-fA,1,1741536484.968555
UgwioZGeuTDSSeF24cR4AaABAg.AFPagfw5PSiAFTpGTgA8zu, @elendile47  who is we ??,2 days ago,@chicksss4377,UCKITyTUq6HI092uQniPsWsg,1,1741622884.971377
UgwioZGeuTDSSeF24cR4AaABAg.AFPagfw5PSiAFUq7nK6i0y, @Azurasmar0 he’s a French-algerian but still a French streamer,2 days ago (edited),@Luna-dh6yt,UC75jkk_Y8R-stAa9WLeQngg,0,1741622884.972997
UgwioZGeuTDSSeF24cR4AaABAg.AFPagfw5PSiAFUqCfFTA8Q, @elendile47 alors toi shut up,2 days ago,@Luna-dh6yt,UC75jkk_Y8R-stAa9WLeQngg,0,1741622884.976526
UgwI2UXP8_taOJBwyCp4AaABAg,ouais cute cute but euh...,4 days ago,@Djsok,UCFh2NClaIysgiCHeM33FAYQ,1,1741453685.319408
UgyJ1rt9vU0Vbzscs5t4AaABAg,Merci pour les travaux,4 days ago,@ch00ka_,UCBS0kTMa56mYIVvuS8_F-tA,0,1741453685.320104
Ugz4xF4sUMWVPf0skd94AaABAg,🇫🇷✨️,4 days ago,@user-nc7jj7vx2z,UCUuLZvAq_wS05t24fO15JNA,0,1741453685.320892
UgxVM_OmEeibyAaDdZ14AaABAg,Dans quel bourbier tu t'es mis frérot ?! un rebeu séquestré ... #freeamine,4 days ago (edited),@SilverGlobe77,UCISntek-kRB027enbRMFfbQ,0,1741453685.321473
UgyNrh5qamoInE_BNqZ4AaABAg,Ce duo incroyable !!,4 days ago,@liloafflecomte5842,UCfO3_i-vDdawxDN5F1U1Erg,0,1741453685.322023
UgynHq3xtkdeeX7RSj54AaABAg,Je savais pas que ça pouvais être aussi drôle un appart tour,4 days ago,@KaarMar,UC18grenklmBAEXTkSfeT0dg,88,1741453685.322572
UgzGqoQjZ2NkE9vkE4V4AaABAg,Le duo est grave golri =,4 days ago,@what4401,UCLcwYFmXONa5SfTcIPsswxQ,0,1741453685.323818
Ugz9JGa609oPj_HLOFx4AaABAg,More content with Amine please,4 days ago,@mikarenminai,UCb4e58l-_fcjA-aMonG5gyw,22,1741453685.324735
UgxP_tDzseG0PmYJcdx4AaABAg,Et moi jsuis là avec mon 11m2,4 days ago,@kangarsta,UCtsVlVN_hk2ljDygTi-V_9w,0,1741453685.32553
Ugxmr8oenyjRs4xRgjx4AaABAg,amine il avait pas envie d'etre la mdrrrrr,4 days ago,@originals.3059,UCK75L-Q3_WQXEBYXQnBE5mg,0,1741453685.326242
Ugz7i38fmw7cfpachh14AaABAg,they're so siblings coded jdjsdj their back and forths are the same as my little brother and I's,4 days ago,@97hanabi,UC-k7RxPE_JIvb_BrnzkhYfw,0,1741453685.326835
UgwpyCRDdK4fapw-Es54AaABAg,Wsh amine sur la miniature on dirait pas lui😂,4 days ago,@mikarenminai,UCb4e58l-_fcjA-aMonG5gyw,2,1741453685.327388
UgyrRiOT42e8SC1Aj8J4AaABAg,L’appart il sent la naftaline mdr,4 days ago,@SatyreBBL,UCYbnmy1EGT87pkoiJgL3wXA,1,1741453685.328029
Ugw3y79WGdZGT6rTyHV4AaABAg,pitié mettez vous ensemble vous êtres trop chou💕,4 days ago,@mel34000,UCX1iRJ0ANw8xF9CDTZO7oYA,1,1741453685.328892
Ugzpo832cJoyrZLmw4F4AaABAg,Thanks Amine for saving me from the fire last month and giving me 100k €. You’re a hero ! 🙏🏽,4 days ago,@djibrilhamilton564,UCDjPv9xz7T6bmrBHEaB1oLQ,11,1741453685.329451
UgxIi5ityzmpU34cCjh4AaABAg,A great innovative simple and unique place to stay,4 days ago,@ranglerradar6535,UCr2onOjr-CcfBvgILhhQqwQ,0,1741453685.32999
UgwE2R-8aR5QSy7jDbB4AaABAg,And This IS how i met Your mother kids…,4 days ago,@kemi_story,UCHOe4VB9UlkMhfBWrZQ9lKw,3,1741453685.330524
UgwWEN1WF8mEYZnJoiR4AaABAg,15:21 amine c’est une galère 😂,4 days ago,@wtfyurpi,UCA7E_O3QwjnXjM9EomnaBeg,2,1741453685.331061
UgxOX8U0b7dvQUbXXzh4AaABAg,14:30 😂😂😂,4 days ago,@wtfyurpi,UCA7E_O3QwjnXjM9EomnaBeg,2,1741453685.331589
UgwgwJj0YwRJjkGOW-d4AaABAg,At 2:22 he definitely said wank and not work haha,4 days ago,@Paul-yv4yg,UCp3cWXeVSDiZvOc5Vxv_wXw,0,1741453685.332125
UgxP_tDzseG0PmYJcdx4AaABAg.AFPVtwixmVgAFRmIYNMuxA,Continue d’engraisser tes ytber préféré pleins aux as dans ton 11m2🫵😹,3 days ago,@Azurasmar0,UCGVds5-1K1pNqtVeTxRjlRQ,0,1741536485.531559
Ugxzfv53Qddy_SBr6ah4AaABAg,About the salt I can explain so ill y a une croyance qui provient des pays de l’Est selon laquelle si tu place une petit bol de sel au coin d’une chambre le sel deviendra noir si la chambre est hantée par des mauvais esprits. C’est pas vraiment de la sorcellerie mais plutôt de la superstition je conseille tout de même de pas y toucher. Voili voilouuu 😌,4 days ago,@journalintimeofkate4284,UC1f4qZRx-_NUbexBYqAem1A,0,1741453685.829472
UgwN54nGYGx6Dc2xg4R4AaABAg,The salt under the bed is only for spiritual protection. Nothing alarming here !! It's even a good thing with all the old stuff in that appartement !!,4 days ago,@yunkhan3094,UCODEf5EbPIebs_oUXsI-duQ,0,1741453685.832373
Ugx43q9cAhazw7ouceB4AaABAg,écouté pokimane parlée si bien français me dis que je peux aussi apprendre à parler Anglais,4 days ago,@VORTEX-yj8hk,UCWSFvxqGy6PT4Bxbz9wUVCA,4,1741453685.833139
Ugwk4sE2zEsyLOdwN-Z4AaABAg,Definitely smashed after this,4 days ago,@rottebazooka,UCgn5G1fbHP96sswh-X09uZQ,1,1741453685.833722
Ugz7aKBHQPzlgJRTt0V4AaABAg,Trop mignon tout ça !!!!!!,4 days ago,@Naïlys_91322,UCsov7K9lbrzNqPXls7c7GKw,0,1741453685.834286
UgwbMLvEG3LHwU9bTON4AaABAg,13:04 ils sont trop mims je pense que vous êtes un duo hyper bien (pas amoureux)❤,4 days ago,@5mariacyrine5,UCITOEoc75X8ittZIucPhPMg,0,1741453685.834824
Ugz-gz8E882poLowKip4AaABAg,2min in already love that guy,4 days ago,@mrwatermelo50,UC7Fp4QHf_HmBFzKyyTWUZZg,21,1741453685.835987
UgzsfMNlLtQ4kU3rQ1V4AaABAg,I discovered poki through amine and you two together bring such a calming and fun vibe and i love that!,4 days ago,@evambz,UCXBx4WaXfUqKwdyWiDkR9PQ,5,1741453685.8368
UgyxBszLNmfhwuDtew14AaABAg,Amine qui ne se sent pas à sa place 🤣,4 days ago,@mickaelboissard2681,UCfotNiKMwLy319AY2pyK8XQ,0,1741453685.837365
UgxglqqrhWrtIJpoDrt4AaABAg,"j'ai TROP aimé, PLUS DE VIDÉO AVEC AMINE SVPPPPPP! ;(",4 days ago,@grymzzygames9689,UCyN2oFUJCb_p8KQB5K-U9UQ,2,1741453685.83791
Ugx6AnVmj13kkfkZ-l14AaABAg,16:51 hello poki alors juste pour expliquer le gros sel est utilisé pour écarter les mauvais esprits et les mauvaises énergies. Ce n’est pas de la sorcellerie au contraire.,4 days ago,@soyume99,UCM9KDo5nb5hcZO-f-pi5dRw,0,1741453685.838447
UgzmIDLkMW2qyriSq6d4AaABAg,ils vont trop bien ensemble 😭🤍,4 days ago,@dwutl,UC1kra89gmLzjy8DsoWroKHg,0,1741453685.838988
UgyoKfqqrOFeK_teTcx4AaABAg,"On adore le duo Amine Pokiman! On voit une autre facette de Amine et j'adore ta personnalité 🥰 
En couple ou amis on n'a pas à savoir, c'est votre vie! J'espere que le duo ne changera pas. Moi j'adore cette ambiguïté.",4 days ago,@safiana3448,UCyVL_3oJ2v5aTbteFb2dRmA,3,1741453685.839527
UgyGfR3Vv1xGQHrFH-54AaABAg,Ah chuis trop heureuse merci pour cette dose de divertissement,4 days ago,@Naïla-ff,UCwuhmk8oXuQF1jFEDAtiibg,4,1741453685.840052
UgxdXRgC4btIZxXNTAV4AaABAg,"Le bol de sel c'est pour l'humidité, le sel aspire l'humidité",4 days ago,@maxvidal5261,UCKgCQbmPS7YLwiWbwVagGpA,0,1741453685.840579
UgwoMRZ0SP1mkrRR0mB4AaABAg,i hope she will stay in safety even if she shows lot of windows here :/,4 days ago,@mecapart,UCFUon13IL1l-Uh9t1vYBDjA,1,1741453685.841101
UgxiefGq9wIQ3sqKF954AaABAg,Attends.... le mec commande un deliveroo pour 2 cafés ?? C'est quoi ce niveau de bourgeoisie mdrrr,4 days ago,@blasedefou,UCBfoAyt6nzzCr_oqCj01SLw,6,1741453685.841624
UgygjB4Y1dceKXFtxOp4AaABAg,"""Finally the burger is gone"" XDDD",4 days ago,@Savyna_Hawke,UC2dftlj7ITlWLBLwAQ3O72w,5,1741453685.842149
UgxXS7i3K3926OTtrVZ4AaABAg,The interaction between the two is cute and hilarious at times!,4 days ago,@xSveto40397,UC7Dnd0yNZrTg3x9XGBzwrgA,21,1741453685.84267
UgzfPGpOHERh734v6rd4AaABAg,🍿🍿🍿,4 days ago,@Esprit_Shonen,UC979FR_esCvA39t54vuiu9g,1,1741453685.843196
UgwPbcoF6EPTDwwIyZp4AaABAg,7:02 eggs in the fridge ????! NOOO,4 days ago,@montonoir,UCmlgIar4lAVJgXCPmQV60wQ,1,1741453686.221754
UgzzxomnxdhtDUA1Lwl4AaABAg,Pressé de voir Billy lâcher Amine car Billy est trop matrixé par sa religion.. Non en vrai je serai le plus triste du monde pour eux mais j’ai peur que ca arrive car aux yeux de Billy c’est haram ce que fait Amine j’en suis sûr,4 days ago,@Baguiguane,UCqptvHReMLP12uBKlYTjFFg,1,1741453686.224252
UgxTqxXo_BsT05GQIBd4AaABAg,Là pour mon gaté,4 days ago,@mugen___,UCAzulBv-Wp3GesmtlTFazIw,0,1741453686.226134
Ugw-TFgL1v769vYuwqp4AaABAg,my fav duo poki the princess and amine le singe,4 days ago,@ashlhwy,UC9v08J9Am--0MoCQkk2d8kA,12,1741453686.226788
UgywoNCL1pCDNcoHU2Z4AaABAg,"Super ta vidéo home tour mais fais attention à ne pas trop montrer où est ce que tu habites à Paris 
Les gens sont des fou !!",4 days ago,@paul172,UC3NdZ1BsSkM7S6O4W7M_C3g,0,1741453686.227385
UgwUd4LRNArUf1oV1th4AaABAg,Amine is such big brother bully vibes,4 days ago,@elhenwhe,UC6z2T7JtecMFq-LInJbKRwA,424,1741453686.228151
Ugy2iHlBLaJ9Bju9sgx4AaABAg,Je vais mourir dès qu’amine filme c'est flou on peut pas compter sur lui💀 pokiman you are perfect 🤍,4 days ago,@purple4823,UCgJFJWYcmL1OvTeoKbp3avg,15,1741453686.228785
UgxJKjPrEPCLpfQENLV4AaABAg,Elle goûté du sel vaudoue 😭😭😭😭,4 days ago,@loren8286,UCi_5oy46Uc-_NldQQtwPSvQ,0,1741453686.229343
UgxqhgGoSLZ316AyvZp4AaABAg,3:21 You thought we wouldn't notice the Hollow Knight OST playing for a couple seconds.,4 days ago,@kelcysun6915,UC6M0Z-paVbQrAJylNuPjwSA,0,1741453686.229882
UgwkJiVVjunfRZNNY0h4AaABAg,Please I need them to date,4 days ago,@gummydoryMMD,UC8-DJTOwhRe6kK0OO8mptSQ,0,1741453686.230421
UgwbwvYhSlSqFxc29V54AaABAg,le soldat est tombé a terre il est piqué de fou amine,4 days ago,@sawisawi-ni7xx,UCsUGHUgrgwpgQIkGjgZy1VQ,4,1741453686.230947
Ugz6vI-gPTPxgnXVsgN4AaABAg,Your outfit looks soo cute! ❤,4 days ago,@Tywele,UCIxtUCI8zzyrScjugj6rchQ,2,1741453686.231474
Ugz9CwFHeY6z3Wq1ODN4AaABAg,"This is romance duo ? 😊 
Je suis sûr qu’il se passe ne belle histoire entre eux deux ❤",4 days ago,@nicolasl34-s6p,UC2WbC9F-e3AmRD_xjyqCSxw,0,1741453686.231999
Ugxql6NcdrsrCUGjJ3J4AaABAg,"16:54 le fait qu’il est du gros sel, c’est une méthode utilisée pour chasser les mauvais esprits, ajouter à ça le signe chelou de qu’il y a sur le lit cet appartement est TRÈS bizarre et terrifiant",4 days ago,@xslydeur831,UCL3eJ9zWvV25glpNS2KnvgA,2,1741453686.232522
UgxvJbNPfROw57yHnWB4AaABAg,"You show your street, your entrance hall, your apartment... You're a woman on top of that and you're a youtuber, so break-ins and muggings can happen because it's not safe.",4 days ago,@Aurora-pr5hm,UC8dLmt84Su5q7uDiiVWFiTQ,0,1741453686.233051
UgxZyO2Hw_TQ8JqY8RJ4AaABAg,Franchement bon duo et amine toujours en mode tipere 😂,4 days ago,@bankai8382,UCaOj_QYDmzp_CAOGsSKnGhw,0,1741453686.233669
UgzIwyIn2hp9GhNBwn94AaABAg,"Pour le coup merci, les morning good vibes m’ont rendu heureux ahahahah",4 days ago,@fautix0783,UCwovO9Df_uBAr4phQOZDs0Q,0,1741453686.234687
UgwNXcINdLFDcE3Vsxh4AaABAg,Ql renard ce amine 😂,4 days ago,@geoffreydulauroy6960,UCRCzG0jH2juJo6fB8L3jmcg,0,1741453686.235446
UgzLX4r270hywVEVRDV4AaABAg,"Le sel sous le lit, c’est pour absorber l’humidite qu’il peut y avoir dans la pièce. On fait souvent ça dans les vieux appartement, souvent mal isolé :)",4 days ago,@elodiel.4793,UCtQErz-sc9iX1WrhKiS6rUQ,693,1741453686.236134
UgydWQ2EPnImkMPEnfR4AaABAg,je veux voir ce duo tout le temps!,4 days ago,@Ceiden,UCtBx0N6E3tczva5DTCp1b9g,3,1741453686.236746
UgzzxomnxdhtDUA1Lwl4AaABAg.AFPFIvxHRb-AFPRclECfkr,Qu’est-ce qu’il a fait de mal amine ?,4 days ago,@EAlY_6,UCdTrHRyi6XkDMk8-gFzHPHg,1,1741453686.473841
UgzzxomnxdhtDUA1Lwl4AaABAg.AFPFIvxHRb-AFQAQ-2VsBf,"@ en islam, tu vas pas dans l’appartement d’une meuf en privée si c’est pas ta femme. (En one to one)",3 days ago (edited),@Baguiguane,UCqptvHReMLP12uBKlYTjFFg,0,1741536486.475647
UgzzxomnxdhtDUA1Lwl4AaABAg.AFPFIvxHRb-AFQTN7ORc4e,Grave ! Ils sont complètement cinglés avec la religion,3 days ago,@Bouillebouboule,UCmHfytv4FnQCIhRkA4MFRrw,0,1741536486.477239
UgzzxomnxdhtDUA1Lwl4AaABAg.AFPFIvxHRb-AFRmYm8Zwqo, @Baguiguane tqt pas il y a bien ont bien fait zinna dans tout l’appart,3 days ago,@Azurasmar0,UCGVds5-1K1pNqtVeTxRjlRQ,0,1741536486.478675
UgzzxomnxdhtDUA1Lwl4AaABAg.AFPFIvxHRb-AFRmi8upYxM,"Ton Billy il est dans la religion mais ne s’occupe que de sa communeauté les ptits ukrainiens mahorais et autres kuffr il n’y est pas sensible, c’est donc ça la fameuse humanité des musulmans…",3 days ago,@Azurasmar0,UCGVds5-1K1pNqtVeTxRjlRQ,0,1741536486.48015
UgzzxomnxdhtDUA1Lwl4AaABAg.AFPFIvxHRb-AFTIIZKs-Qi, @Azurasmar0 mais toi tu sais pas ce que ça veut dire garder le bon soupçon ?,2 days ago,@Hindd_elm,UCODjZXbZLZNuyzITUzDrX-g,0,1741622886.482248
UgwUd4LRNArUf1oV1th4AaABAg.AFPDWEbQZzYAFT5cWNdZrP, @elhenwhe  BAHAHHA THAT'S EXACTLY HIM  🤣🤣,2 days ago,@Ducacadequalite,UC3JUyaOay7q9FgYn6lvxFXw,8,1741622886.703744
UgwUd4LRNArUf1oV1th4AaABAg.AFPDWEbQZzYAFTDAcxvxk1,"Don't say that he's like a brother, U'll make him cry",2 days ago,@KingofTheDarkestSprings,UCFpEwwAijlxvHo8xsEuuLtg,3,1741622886.705899
UgzLX4r270hywVEVRDV4AaABAg.AFP72hFAi5LAFPJOU3T7pf,Surtout avec une baignoire dans la chambre j'imagine pas l'humidité,4 days ago,@MrMerildoll,UCaD0K4_4mnsNH2M1lPsbMxg,56,1741453686.925781
UgzLX4r270hywVEVRDV4AaABAg.AFP72hFAi5LAFRfM21iZu3,Ça sert aussi à absorber les énergies négatives,3 days ago,@Moso24,UCyMdHnTOmkZLXQF4-HcqrBg,11,1741536486.928038
UgzLX4r270hywVEVRDV4AaABAg.AFP72hFAi5LAFRhSFwvjNJ,"​ @Moso24 ça ne marche pas ce truc, après chacun ses croyances 😅 ma mère faisait toujours ça mdrr",3 days ago,@aexma,UCrLV4ZQglD1ch85MZfbyKbA,4,1741536486.930568
UgzLX4r270hywVEVRDV4AaABAg.AFP72hFAi5LAFTKzZrj7H2, @Moso24  plutôt vital je pense mdr,2 days ago,@Yannse667,UCUGw46P6H61NXTovxUPBU5w,0,1741622886.9333
UgzLX4r270hywVEVRDV4AaABAg.AFP72hFAi5LAFU-h5gApKG," @aexma  après dans le contexte de la vidéo le bol de sel était placé sous le lit et non proche de la baignoire, le sel a une portée très courte pour absorber l'humidité il faut la placé proche de l'endroit où c'est le plus humide. Et le bol de sel placé sous le lit ça signifie en premier lieu que ça sert à absorber les énergies négatives et à éviter les cauchemars. En même temps l'appartement à plusieurs siècles donc pas étonnant qu'il peut y avoir des énergies négatives.",2 days ago,@Moso24,UCyMdHnTOmkZLXQF4-HcqrBg,3,1741622886.935262
UgzLX4r270hywVEVRDV4AaABAg.AFP72hFAi5LAFUmKDW4ZqT,"Non, ils font sorcellerie sur toi... lol",2 days ago,@claudemoney6798,UCXejGsYJq9EbDXyFLEZTyww,1,1741622886.93715
UgzLX4r270hywVEVRDV4AaABAg.AFP72hFAi5LAFUvXiQXsTp,"Alors ca fait 3 ans que je vis sous un escalier avec une seule fenetre, j'aurais tellement aimé savoir ça au début mdrrrr",2 days ago,@PowwerPulse,UCRTndi0VsZi8ocbUzZxHPeg,0,1741622886.938915
